{
  "id": "VAL-BOOT-003",
  "name": "Validar el arranque después de revertir el cambio",
  "type": "restart",
  "expected": "Windows inicia y permanece estable después de revertir el cambio.",
  "failureMessage": "Windows continúa fallando. Prueba Reparación de inicio.",
  "successNext": "rescue-plan-complete",
  "failureNext": "WHPRS-REC-001",
  "status": "active",
  "version": "1.0.0"
}