{
  "id": "VAL-NET-003",
  "name": "Validar acceso a Internet después de renovar la red",
  "type": "manual",
  "expected": "Windows deja de mostrar “Sin Internet” y la navegación funciona.",
  "failureMessage": "La red continúa sin acceso. Comprueba el router, el proveedor y otros dispositivos.",
  "successNext": "rescue-plan-complete",
  "failureNext": "WHPRS-NET-002",
  "status": "active",
  "version": "1.0.0"
}