{
  "id": "VAL-GAM-004",
  "name": "Validar rendimiento con energía estable",
  "type": "manual",
  "expected": "El equipo mantiene rendimiento estable conectado a corriente y sin sobrecalentamiento.",
  "failureMessage": "El rendimiento sigue limitado o el equipo se calienta. Restablece el modo de energía y revisa refrigeración.",
  "successNext": "rescue-plan-complete",
  "failureNext": "technical-escalation",
  "status": "active",
  "version": "1.0.0"
}