{
  "id": "VAL-SEC-002",
  "name": "Validar que el archivo sospechoso fue controlado",
  "type": "manual",
  "expected": "El examen termina, no quedan amenazas activas y el archivo sospechoso no vuelve a ejecutarse.",
  "failureMessage": "Continúan los síntomas o la amenaza reaparece. Ejecuta el examen sin conexión.",
  "successNext": "rescue-plan-complete",
  "failureNext": "WHPRS-SEC-004",
  "status": "active",
  "version": "1.0.0"
}