{
  "id": "VAL-BSOD-004",
  "name": "Validar estabilidad después de revertir el cambio",
  "type": "restart",
  "expected": "Windows inicia y permanece estable después de retirar o revertir el cambio reciente.",
  "failureMessage": "La pantalla azul continúa. Revisa eventos, memoria y controladores.",
  "successNext": "rescue-plan-complete",
  "failureNext": "WHPRS-DIA-006",
  "status": "active",
  "version": "1.0.0"
}