{
  "id": "VAL-NET-001",
  "name": "Validar que el equipo recuperó conectividad",
  "type": "manual",
  "expected": "El equipo obtiene una dirección IP válida y puede abrir sitios web.",
  "failureMessage": "El equipo continúa sin Internet. Revisa el adaptador, el controlador y el router.",
  "successNext": "rescue-plan-complete",
  "failureNext": "WHPRS-NET-001",
  "status": "active",
  "version": "1.0.0"
}