{
  "id": "VAL-BSOD-003",
  "name": "Validar estabilidad bajo carga",
  "type": "manual",
  "expected": "El equipo completa tareas intensivas sin reiniciarse ni mostrar una pantalla azul.",
  "failureMessage": "El fallo continúa bajo carga. Revisa temperaturas, fuente de energía, RAM y GPU.",
  "successNext": "rescue-plan-complete",
  "failureNext": "technical-escalation",
  "status": "active",
  "version": "1.0.0"
}