{
  "id": "VAL-PERF-001",
  "name": "Validar reducción del uso del disco",
  "type": "metric",
  "expected": "El uso del disco se mantiene por debajo del 90 % durante al menos cinco minutos sin tareas intensivas.",
  "failureMessage": "El uso del disco continúa elevado. Revisa procesos activos, estado SMART y errores del sistema de archivos.",
  "successNext": "rescue-plan-complete",
  "failureNext": "WHPRS-REP-003",
  "status": "active",
  "version": "1.0.0"
}