{
  "id": "VAL-NET-004",
  "name": "Validar estabilidad y pérdida de paquetes",
  "type": "metric",
  "expected": "La conexión permanece estable y no muestra pérdida sostenida de paquetes.",
  "failureMessage": "Continúan los cortes o la pérdida. Revisa Wi-Fi, cableado, router o proveedor.",
  "successNext": "rescue-plan-complete",
  "failureNext": "WHPRS-NET-006",
  "status": "active",
  "version": "1.0.0"
}