{
  "id": "VAL-PERF-002",
  "name": "Validar reducción del uso de memoria",
  "type": "metric",
  "expected": "El uso de memoria se mantiene por debajo del 85 % durante tareas normales.",
  "failureMessage": "La memoria continúa elevada. Revisa aplicaciones, pestañas del navegador y capacidad física de RAM.",
  "successNext": "rescue-plan-complete",
  "failureNext": "WHPRS-DIA-003",
  "status": "active",
  "version": "1.0.0"
}