{
  "id": "VAL-GAM-002",
  "name": "Validar mejora de FPS",
  "type": "metric",
  "expected": "Los FPS aumentan o se mantienen más estables durante la misma escena y configuración gráfica.",
  "failureMessage": "Los FPS continúan bajos. Revisa temperaturas, hardware y requisitos del juego.",
  "successNext": "rescue-plan-complete",
  "failureNext": "technical-escalation",
  "status": "active",
  "version": "1.0.0"
}