{
  "id": "VAL-GAM-003",
  "name": "Validar reducción del stutter",
  "type": "manual",
  "expected": "Los tirones disminuyen durante una sesión comparable de juego.",
  "failureMessage": "El stutter continúa. Revisa RAM, almacenamiento, procesos en segundo plano y temperatura.",
  "successNext": "rescue-plan-complete",
  "failureNext": "WHPRS-DIA-003",
  "status": "active",
  "version": "1.0.0"
}