{
  "id": "VAL-SEC-001",
  "name": "Validar que no quedan amenazas activas",
  "type": "manual",
  "expected": "Historial de protección no muestra amenazas activas ni acciones pendientes.",
  "failureMessage": "Todavía hay una amenaza activa o una acción pendiente. No restaures el archivo y ejecuta un análisis más profundo.",
  "successNext": "rescue-plan-complete",
  "failureNext": "WHPRS-SEC-003",
  "status": "active",
  "version": "1.0.0"
}