{
  "id": "VAL-SEC-003",
  "name": "Validar que desaparecieron los síntomas de malware",
  "type": "manual",
  "expected": "No aparecen redirecciones, ventanas extrañas ni procesos desconocidos después del reinicio.",
  "failureMessage": "Los síntomas continúan. Ejecuta el examen sin conexión y considera asistencia técnica.",
  "successNext": "rescue-plan-complete",
  "failureNext": "WHPRS-SEC-004",
  "status": "active",
  "version": "1.0.0"
}