{
  "id": "VAL-BOOT-002",
  "name": "Validar el arranque después de retirar la actualización",
  "type": "restart",
  "expected": "Windows inicia correctamente después de retirar la actualización reciente.",
  "failureMessage": "El problema continúa. Prueba Restaurar sistema.",
  "successNext": "rescue-plan-complete",
  "failureNext": "WHPRS-REC-004",
  "status": "active",
  "version": "1.0.0"
}