{
  "id": "VAL-NET-002",
  "name": "Validar la resolución DNS",
  "type": "output",
  "expected": "nslookup devuelve direcciones IP y el navegador abre dominios normalmente.",
  "failureMessage": "La resolución DNS continúa fallando. Revisa los servidores DNS configurados y el router.",
  "successNext": "rescue-plan-complete",
  "failureNext": "WHPRS-NET-003",
  "status": "active",
  "version": "1.0.0"
}