{
  "id": "VAL-PERF-003",
  "name": "Validar reducción del uso de CPU",
  "type": "metric",
  "expected": "El uso de CPU disminuye y no permanece por encima del 85 % sin una tarea intensiva activa.",
  "failureMessage": "La CPU continúa elevada. Identifica el proceso, revisa actualizaciones, malware y temperatura.",
  "successNext": "rescue-plan-complete",
  "failureNext": "WHPRS-DIA-003",
  "status": "active",
  "version": "1.0.0"
}