{
  "id": "VAL-SEC-004",
  "name": "Validar la eliminación de una amenaza persistente",
  "type": "restart",
  "expected": "Después del examen sin conexión y el reinicio, Defender no detecta nuevamente la amenaza.",
  "failureMessage": "La amenaza continúa reapareciendo. Desconecta el equipo de la red y busca soporte técnico especializado.",
  "successNext": "rescue-plan-complete",
  "failureNext": "technical-escalation",
  "status": "active",
  "version": "1.0.0"
}